<?xml version='1.0' encoding='iso-8859-1'?> 
<!DOCTYPE pregunta SYSTEM "./../../../clase.dtd">
<p>
<q0>La docente de primer grado sienta a Francisco frente a una maqueta en la que hay varias
montañas Luego, le muestra diversas fotografías tomadas desde diversos ángulos,
preguntándole: ¿Cuáles de ellas has visto? Al responder, Francisco describe aquellas que
muestran las montañas que él ve y no las que vería una persona sentada en frente o al lado
posterior.</q0>
  <q>
 ¿Qué característica del pensamiento se evidencia en la respuesta de Francisco?
  </q>
  <as r="R" correcta="2">
    <a>
    Transitividad.
    </a><a>
    Conservación.
    </a><a>
    Egocentrismo.
    </a><a>
    Irreversibilidad.
    </a>
  </as>
  <x>
C.
</x>
</p>
