<?xml version='1.0' encoding='iso-8859-1'?>
<!DOCTYPE pregunta SYSTEM "./../../../clase.dtd">
<p>
  <q0></q0>
  <g0>./../../preguntas/nom/1primaria/200-300_simulacro/nom-pri-1306-p.png</g0>
  <q>En el texto, ¿cuál de los siguientes hechos es una consecuencia del 'efecto de burbuja'?</q>
  <g></g>
  <q2></q2>
  <g2></g2>
  <as r="R" correcta="2">
    <a>Las redes sociales ajustan los contenidos que muestran según las búsquedas previas de los usuarios.</a>
    <a>La prensa y la televisión pierden audiencia frente a los medios digitales, sobre todo entre los jóvenes.</a>
    <a>Las redes sociales ayudan a que las teorías conspirativas persistan y crezcan en el espacio virtual.</a>
  </as>
  <x>C</x>
  <i></i>
  <x2></x2>
  <i2></i2>
  <v1></v1>
</p>