<?xml version='1.0' encoding='iso-8859-1'?>
<!DOCTYPE pregunta SYSTEM "./../../../clase.dtd">
<p>
  <q0></q0>
  <g0></g0>
  <q>Read the first sentence and choose the correct alternative to complete the second sentence so that it means the
     same as the first. Sentence 1: Stop interrupting me all the time! Sentence 2: I wish you _____________ me.</q>
  <g></g>
  <q2></q2>
  <g2></g2>
  <as r="R" correcta="1">
    <a>don't interrupt</a>
    <a>wouldn't interrupt</a>
    <a>shouldn't interrupt</a>
  </as>
  <x>B</x>
  <i></i>
  <x2></x2>
  <i2></i2>
  <v1></v1>
</p>