<?xml version='1.0' encoding='iso-8859-1'?>
<!DOCTYPE pregunta SYSTEM "./../../../clase.dtd">
<p>
  <q0></q0>
  <g0></g0>
  <q>Considerando el análisis FODA de una empresa de servicios, ¿cuál de las siguientes alternativas corresponde a una
     amenaza?</q>
  <g></g>
  <q2></q2>
  <g2></g2>
  <as r="R" correcta="0">
    <a>Contar con empresas similares en la localidad que tienen mayor experiencia en el rubro.</a>
    <a>Tener poco personal para atender la alta demanda del servicio en su localidad.</a>
    <a>Poseer recursos limitados para realizar publicidad masiva en su localidad.</a>
  </as>
  <x>A</x>
  <i></i>
  <x2></x2>
  <i2></i2>
  <v></v>
</p>