<?xml version='1.0' encoding='iso-8859-1'?>
<!DOCTYPE pregunta SYSTEM "./../../../clase.dtd">
<p>
  <q0></q0>
  <g0>./../preguntas/nom/5comunicacion/200-300_2019/nom-com-5271-p.png</g0>
  <q>Para ayudar a los estudiantes en la comprensión del sentido del texto, la docente ha propuesto varias preguntas.</q>
  <g></g>
  <q2>¿Cuál de las siguientes preguntas es más adecuada para que los estudiantes obtengan información explícita?</q2>
  <g2></g2>
  <as r="R" correcta="2">
    <a>¿Con qué partes de su cuerpo se alimenta el caracol?</a>
    <a>¿Por qué el caracol se contrae al interior de su concha?</a>
    <a>¿Qué le permite al caracol deslizarse mejor sobre las hojas?</a>
  </as>
  <x>C</x>
  <i></i>
  <x2></x2>
  <i2></i2>
  <v></v>
</p>