<?xml version='1.0' encoding='iso-8859-1'?>
<!DOCTYPE pregunta SYSTEM "./../../../clase.dtd">
<p>
  <q0></q0>
  <g0>./../../preguntas/nom/1primaria/200-300_simulacro/nom-pri-1306-p.png</g0>
  <q>En el texto, ¿a qué se refiere la noción de 'posverdad'?</q>
  <g></g>
  <q2></q2>
  <g2></g2>
  <as r="R" correcta="0">
    <a>A un contexto en el que las noticias se aceptan cuando se ajustan a los marcos de creencias de quienes las
       adoptan, sin importar su veracidad.</a>
    <a>A un tipo de noticias que se difunden a través de los medios de comunicación, independientemente de su veracidad.</a>
    <a>A la capacidad de evaluar la veracidad de la información nueva proveniente de las redes sociales y otros medios
       digitales.</a>
  </as>
  <x>A</x>
  <i></i>
  <x2></x2>
  <i2></i2>
  <v1></v1>
</p>