<?xml version='1.0' encoding='iso-8859-1'?>
<!DOCTYPE pregunta SYSTEM "./../../../clase.dtd">
<p>
	<q0>
	</q0>
	<g0>./../../preguntas/nom/1primaria/100-200_2018/nom-pri-1184-p.png
	</g0>
	<q>Durante la experiencia, una pareja de estudiantes propone lo siguiente:
	</q>
	<g0>./../../preguntas/nom/1primaria/100-200_2018/nom-pri-1184-p2.png
	</g0>
	<q2>En la propuesta de los estudiantes, ¿qué tipo de variable corresponde al material de los
vasos?	
	</q2>
	<as r="R" correcta="0">
		<a>Independiente</a>
		<a>Dependiente</a>
		<a>Interviniente</a>
	</as>	
	<x>A.</x>
	<i></i>
	<x2>
	</x2>
	<i2></i2>
	<v></v>
</p>