<?xml version='1.0' encoding='iso-8859-1'?>
<!DOCTYPE pregunta SYSTEM "./../../../clase.dtd">
<p>
	<q0>
	</q0>
	<g0>
	</g0>
<q>Presentan vicios de dicción:
</q>
	<g>./../preguntas/nom/5comunicacion/500/nom-com-5413-p.png
	</g>
<as r="R" correcta="4">
<a>I-III</a>
<a>II-III</a>
<a>I-IV</a>
<a>III-IV</a>
<a>I-III-IV</a>
</as>
<x>E.</x><x2></x2>
</p>