<?xml version='1.0' encoding='iso-8859-1'?> 
<!DOCTYPE pregunta SYSTEM "./../../../clase.dtd">
<p>
    <q>En un aula de inicial se observa que los niños y niñas se desenvuelven con tranquilidad, alegres y actúan
    de forma espontánea. La docente se muestra tranquila y de vez en cuando recalca las normas de convivencia en tono 
    suave. ¿Qué refleja esta situación?
</q>
    <as r="R" correcta="2">
        <a>La docente no interviene y permite que los niños realicen actividades libres.</a>
        <a>La docente tiene poca paciencia con los niños y niñas.</a>
        <a>La docente promueve un clima de buen trato.</a>
        <a>La docente es muy cariñosa con algunos niños y niñas.</a>
    </as>
    <x>C.</x>
</p>
