<?xml version='1.0' encoding='iso-8859-1'?>
<!DOCTYPE pregunta SYSTEM "./../../../clase.dtd">
<p>
	<q0>
	</q0>
	<g0>./../../preguntas/nom/4cta/100-200_2018/nom-cta-4158-p.png
	</g0>
	<q>¿A cuál de las siguientes preguntas se busca responder con los resultados que se presentan
en los gráficos?
	</q>
	<q2>	
	</q2>
	<as r="R" correcta="1">
		<a>¿Qué relación existe entre las concentraciones de glucosa y lactato en la sangre de una
persona?</a>
		<a>¿Qué diferencias hay entre las concentraciones de glucosa y lactato en la sangre de una
persona al inicio y fin de una actividad deportiva intensa?</a>
		<a>¿Por qué las concentraciones de glucosa y lactato en la sangre de las personas cambian
luego de realizar una actividad deportiva intensa?</a>
	</as>	
	<x>B.</x>
	<i></i>
	<x2>
	</x2>
	<i2></i2>
	<v></v>
</p>