<?xml version='1.0' encoding='iso-8859-1'?>
<!DOCTYPE pregunta SYSTEM "./../../../clase.dtd">
<p>
  <q0></q0>
  <g0></g0>
  <q>¿A qué paso de la Lectio Divina corresponden las siguientes preguntas?</q>
  <g>./../../preguntas/nom/8religion/100-200_2018/nom-rel-8171-p.png</g>
  <q2></q2>
  <g2></g2>
  <as r="R" correcta="2">
    <a>Lectura</a>
    <a>Meditación</a>
    <a>Contemplación</a>
  </as>
  <x>C</x>
  <i></i>
  <x2></x2>
  <i2></i2>
  <v></v>
</p>